{
  "schemaVersion": 2,
  "title": "AI 融资年度回顾",
  "goal": "面向投资团队汇报 AI 融资年度进展、关键变化和下一步判断",
  "audience": "投资团队",
  "owner": "研究团队",
  "randomSeed": "theme08-example",
  "pageCount": 5,
  "themePack": "theme08",
  "variantOutputMode": "comparison",
  "slides": [
    {
      "id": "s1",
      "content": {
        "eyebrow": "示例封面",
        "headlineLine1": "AI 融资年度回顾",
        "headlineHl": "AI 融资年度回顾",
        "subtitle": "面向投资团队汇报 AI 融资年度进展、关键变化和下一步判断",
        "yearTag": "2026",
        "goldenLine": "AI 融资年度回顾",
        "handNote": "投资团队 / 研究团队",
        "kicker": "示例封面",
        "bespokeTitle": "AI 融资年度回顾",
        "bespokePoints": [
          "面向投资团队汇报 AI 融资年度进展、关键变化和下一步判断",
          "投资团队 / 研究团队"
        ]
      },
      "selectedVariant": "v1",
      "variants": [
        {
          "id": "v1",
          "kind": "template",
          "layout": "theme08_page001",
          "props": {},
          "contentMap": {
            "eyebrow": "eyebrow",
            "headlineLine1": "headlineLine1",
            "headlineHl": "headlineHl",
            "subtitle": "subtitle",
            "yearTag": "yearTag",
            "goldenLine": "goldenLine",
            "handNote": "handNote"
          }
        },
        {
          "id": "v2",
          "kind": "template",
          "layout": "theme08_page002",
          "props": {},
          "contentMap": {
            "kicker": "kicker",
            "subtitle": "subtitle"
          }
        },
        {
          "id": "v3",
          "kind": "template",
          "layout": "theme08_page003",
          "props": {},
          "contentMap": {
            "eyebrow": "eyebrow",
            "handNote": "handNote"
          }
        },
        {
          "id": "v4",
          "kind": "bespoke",
          "adjustable": false,
          "composition": {
            "designIntent": {
              "objective": "建立AI 融资年度回顾的汇报范围",
              "audience": "投资团队",
              "narrativeRole": "封面定调",
              "emphasis": "AI 融资年度回顾",
              "rationale": "使用单一标题中心和两条关键信息建立清晰层级"
            },
            "background": "default",
            "elements": [
              {
                "id": "title",
                "type": "text",
                "grid": {
                  "column": 1,
                  "row": 1,
                  "width": 10,
                  "height": 2
                },
                "role": "title",
                "text": ""
              },
              {
                "id": "points",
                "type": "list",
                "grid": {
                  "column": 1,
                  "row": 4,
                  "width": 8,
                  "height": 3
                },
                "items": []
              }
            ]
          },
          "contentMap": {
            "elements[0].text": "bespokeTitle",
            "elements[1].items": "bespokePoints"
          }
        }
      ]
    },
    {
      "id": "s2",
      "content": {
        "eyebrow": "示例页面 2",
        "headline": "AI 融资年度回顾 · 2",
        "subheadline": "AI 融资年度回顾 · 2",
        "summary": "面向投资团队汇报 AI 融资年度进展、关键变化和下一步判断 · 第 2 页",
        "bespokeTitle": "AI 融资年度回顾 · 2",
        "bespokePoints": [
          "面向投资团队汇报 AI 融资年度进展、关键变化和下一步判断 · 第 2 页",
          "投资团队 / 研究团队"
        ]
      },
      "selectedVariant": "v1",
      "variants": [
        {
          "id": "v1",
          "kind": "template",
          "layout": "theme08_page006",
          "props": {},
          "contentMap": {
            "eyebrow": "eyebrow",
            "headline": "headline",
            "subheadline": "subheadline",
            "summary": "summary"
          }
        },
        {
          "id": "v2",
          "kind": "template",
          "layout": "theme08_page007",
          "props": {},
          "contentMap": {
            "eyebrow": "eyebrow",
            "headline": "headline",
            "subheadline": "subheadline"
          }
        },
        {
          "id": "v3",
          "kind": "template",
          "layout": "theme08_page008",
          "props": {},
          "contentMap": {
            "eyebrow": "eyebrow",
            "headline": "headline",
            "subheadline": "subheadline",
            "summary": "summary"
          }
        },
        {
          "id": "v4",
          "kind": "bespoke",
          "adjustable": false,
          "composition": {
            "designIntent": {
              "objective": "解释AI 融资年度回顾第 2 页的核心信息",
              "audience": "投资团队",
              "narrativeRole": "论证推进",
              "emphasis": "面向投资团队汇报 AI 融资年度进展、关键变化和下一步判断",
              "rationale": "使用单一标题中心和两条关键信息建立清晰层级"
            },
            "background": "default",
            "elements": [
              {
                "id": "title",
                "type": "text",
                "grid": {
                  "column": 1,
                  "row": 1,
                  "width": 10,
                  "height": 2
                },
                "role": "title",
                "text": ""
              },
              {
                "id": "points",
                "type": "list",
                "grid": {
                  "column": 1,
                  "row": 4,
                  "width": 8,
                  "height": 3
                },
                "items": []
              }
            ]
          },
          "contentMap": {
            "elements[0].text": "bespokeTitle",
            "elements[1].items": "bespokePoints"
          }
        }
      ]
    },
    {
      "id": "s3",
      "content": {
        "eyebrow": "示例页面 3",
        "headline": "AI 融资年度回顾 · 3",
        "subheadline": "AI 融资年度回顾 · 3",
        "summary": "面向投资团队汇报 AI 融资年度进展、关键变化和下一步判断 · 第 3 页",
        "bespokeTitle": "AI 融资年度回顾 · 3",
        "bespokePoints": [
          "面向投资团队汇报 AI 融资年度进展、关键变化和下一步判断 · 第 3 页",
          "投资团队 / 研究团队"
        ]
      },
      "selectedVariant": "v1",
      "variants": [
        {
          "id": "v1",
          "kind": "template",
          "layout": "theme08_page018",
          "props": {},
          "contentMap": {
            "eyebrow": "eyebrow",
            "headline": "headline",
            "subheadline": "subheadline",
            "summary": "summary"
          }
        },
        {
          "id": "v2",
          "kind": "template",
          "layout": "theme08_page019",
          "props": {},
          "contentMap": {
            "eyebrow": "eyebrow",
            "headline": "headline",
            "subheadline": "subheadline",
            "summary": "summary"
          }
        },
        {
          "id": "v3",
          "kind": "template",
          "layout": "theme08_page020",
          "props": {},
          "contentMap": {
            "eyebrow": "eyebrow",
            "headline": "headline",
            "subheadline": "subheadline",
            "summary": "summary"
          }
        },
        {
          "id": "v4",
          "kind": "bespoke",
          "adjustable": false,
          "composition": {
            "designIntent": {
              "objective": "解释AI 融资年度回顾第 3 页的核心信息",
              "audience": "投资团队",
              "narrativeRole": "论证推进",
              "emphasis": "面向投资团队汇报 AI 融资年度进展、关键变化和下一步判断",
              "rationale": "使用单一标题中心和两条关键信息建立清晰层级"
            },
            "background": "default",
            "elements": [
              {
                "id": "title",
                "type": "text",
                "grid": {
                  "column": 1,
                  "row": 1,
                  "width": 10,
                  "height": 2
                },
                "role": "title",
                "text": ""
              },
              {
                "id": "points",
                "type": "list",
                "grid": {
                  "column": 1,
                  "row": 4,
                  "width": 8,
                  "height": 3
                },
                "items": []
              }
            ]
          },
          "contentMap": {
            "elements[0].text": "bespokeTitle",
            "elements[1].items": "bespokePoints"
          }
        }
      ]
    },
    {
      "id": "s4",
      "content": {
        "eyebrow": "示例页面 4",
        "headline": "AI 融资年度回顾 · 4",
        "subheadline": "AI 融资年度回顾 · 4",
        "summary": "面向投资团队汇报 AI 融资年度进展、关键变化和下一步判断 · 第 4 页",
        "bespokeTitle": "AI 融资年度回顾 · 4",
        "bespokePoints": [
          "面向投资团队汇报 AI 融资年度进展、关键变化和下一步判断 · 第 4 页",
          "投资团队 / 研究团队"
        ]
      },
      "selectedVariant": "v1",
      "variants": [
        {
          "id": "v1",
          "kind": "template",
          "layout": "theme08_page030",
          "props": {},
          "contentMap": {
            "eyebrow": "eyebrow",
            "headline": "headline",
            "subheadline": "subheadline",
            "summary": "summary"
          }
        },
        {
          "id": "v2",
          "kind": "template",
          "layout": "theme08_page031",
          "props": {},
          "contentMap": {
            "eyebrow": "eyebrow",
            "headline": "headline",
            "subheadline": "subheadline",
            "summary": "summary"
          }
        },
        {
          "id": "v3",
          "kind": "template",
          "layout": "theme08_page032",
          "props": {},
          "contentMap": {
            "eyebrow": "eyebrow",
            "headline": "headline",
            "subheadline": "subheadline",
            "summary": "summary"
          }
        },
        {
          "id": "v4",
          "kind": "bespoke",
          "adjustable": false,